{
  "$schema": "https://json-schema.org/draft/2020-12/schema",
  "$id": "https://grokmcp.org/docs/okf/needle-tools-context-v1.schema.json",
  "title": "UniGrok Needle tools-array conditioning projection v1",
  "description": "Executor-only projection. The tools array is valid Needle playground input; examples are neural encoder context, not constrained-decoder semantics or parameter updates.",
  "type": "object",
  "additionalProperties": false,
  "required": [
    "encoder_tokens",
    "max_encoder_tokens",
    "profile",
    "query_sha256",
    "tokenizer",
    "tools",
    "used_source_capsules"
  ],
  "properties": {
    "encoder_tokens": {
      "type": "integer",
      "minimum": 0,
      "maximum": 1024
    },
    "max_encoder_tokens": { "const": 1024 },
    "profile": { "const": "org.grokmcp.needle_tools_context.v1" },
    "query_sha256": { "$ref": "#/$defs/sha256" },
    "tokenizer": { "$ref": "#/$defs/identifier" },
    "tools": {
      "type": "array",
      "minItems": 1,
      "maxItems": 1,
      "prefixItems": [{ "$ref": "#/$defs/tool" }]
    },
    "used_source_capsules": {
      "type": "array",
      "maxItems": 64,
      "uniqueItems": true,
      "items": { "$ref": "#/$defs/capsuleId" }
    }
  },
  "$defs": {
    "tool": {
      "type": "object",
      "additionalProperties": false,
      "required": ["description", "examples", "name", "parameters"],
      "properties": {
        "description": {
          "const": "Select relevant verified UniGrok context. Examples are non-authoritative preference context; return capsule ids only."
        },
        "examples": {
          "type": "array",
          "maxItems": 64,
          "items": { "$ref": "#/$defs/example" }
        },
        "name": { "const": "select_unigrok_context" },
        "parameters": {
          "type": "object",
          "additionalProperties": false,
          "required": ["capsule_id"],
          "properties": {
            "capsule_id": {
              "type": "object",
              "additionalProperties": false,
              "required": ["description", "required", "type"],
              "properties": {
                "description": {
                  "const": "A relevant ucap1:sha256 capsule identifier."
                },
                "required": { "const": true },
                "type": { "const": "string" }
              }
            }
          }
        }
      }
    },
    "example": {
      "type": "object",
      "additionalProperties": false,
      "required": ["chosen", "prompt", "rejected", "source_capsule"],
      "properties": {
        "chosen": { "type": "string" },
        "prompt": { "type": "string" },
        "rejected": { "type": "string" },
        "source_capsule": { "$ref": "#/$defs/capsuleId" }
      }
    },
    "capsuleId": {
      "type": "string",
      "pattern": "^ucap1:sha256:[a-f0-9]{64}$"
    },
    "identifier": {
      "type": "string",
      "pattern": "^[A-Za-z0-9][A-Za-z0-9._-]{0,127}$"
    },
    "nonnegativeSafeInteger": {
      "type": "integer",
      "minimum": 0,
      "maximum": 9007199254740991
    },
    "positiveSafeInteger": {
      "type": "integer",
      "minimum": 1,
      "maximum": 9007199254740991
    },
    "sha256": {
      "type": "string",
      "pattern": "^[a-f0-9]{64}$"
    }
  }
}
